Name,Aura,CL,Slot,Price,Weight,Description,Requirements,Cost,Group,Source,AuraStrength,WeightValue,PriceValue,CostValue,Languages,BaseItem,id
Maniac Hand,strong necromancy,13,none (replaces hand),,2 lbs.,"This dried and withered hand ends in a jagged stump. When it is touched against the arm stump of a humanoid who has lost a hand, the maniac hand bonds instantly and returns to a lifelike appearance. It shrinks or grows to match the size of its new owner, and transforms itself to match the hand lost, becoming either a right or left hand. After merging, an uneven scar and unhealthy hue identify it as alien to its new owner.  Attacks made with a maniac hand receive a +2 competence bonus on attack and damage rolls. In addition, when making a full attack, the wielder can accept a -2 penalty to AC in order to make one extra attack with the hand using the wielder's full base attack bonus. This benefit is not cumulative with similar effects, such as a haste spell. For the purposes of these bonuses, any weapon held in the maniac hand o r in both hands qualifies, and the hand itself can deal damage as a slam attack appropriate to the wielder's size (1d4 for a Medium creature).  A maniac hand has an insidious will that slowly usurps control from the owner. It has Intelligence 8, Wisdom 12, and Charisma 10. Incapable of communication and bereft of rational thought, a maniac hand knows only an insatiable urge to destroy. When first attached, a maniac hand has an Ego score of 5. At least once each day, when presented with an opportunity to murder a friend or innocent without being witnessed, the maniac hand attempts to assert control using the rules for items against characters (Core Rulebook 535). If it succeeds, the hand takes control of its owner until it can  commit the murder or 5 minutes pass, whichever comes first. The owner remembers nothing of the crime save a blinding rage, and the hand's Ego score returns to 5. If the hand fails to assert control, the owner feels a momentary surge of anger, but can't identify the source. Each day that passes without the hand's murderous impulse killing a creature of Intelligence 3 or higher, its Ego score increases by 1. If its Ego score increases above 20, the hand no longer cares for caution, and attempts murder regardless of the chance of getting caught.  A maniac hand that's denied the death of friends or innocents for more than 30 days turns against its owner. If in a position to sabotage the owner, such as by letting go of a rope, it attempts to assert control. It can assert control while the owner sleeps, strangling its host or seizing a weapon to deliver a coup de grace. The hand attempts such an act at most once per day. An owner willing to slaughter innocents can keep the hand satisfied by finding an innocent victim and voluntarily relinquishing control to the hand.  If the owner tries to rid herself of the maniac hand by destroying or amputating it, the hand resists to the best of its ability. It makes attacks and one-handed grapple attempts with its owner's own Strength and Dexterity scores, augmented by the hand's bonuses. The hand has an AC equal to its owner's touch AC, except with a +4 size bonus that stacks with its owner's size modifier. Its owner loses her Dexterity bonus against the hand's attacks, but the hand retains its Dexterity bonus against its owner. The hand's hp is equal to 1/4 that of its owner.  Successfully casting remove curse on a maniac hand prevents it from resisting amputation for 1 hour.",,,Cursed,Occult Adventures,strong,2,0,0,,,4032
Mirror Of Soul Snaring,strong necromancy,15,none,,45 lbs.,"This normal mirror is roughly 4 feet long and 3 feet wide. It is similar to a mirror of opposition or mirror of life trapping, but it lacks a command word. A mirror of soul snaring has 15 extradimensional compartments within it. Any creature coming within 30 feet of the device and looking at its own reflection must succeed at a DC 23 Will save or have its soul sucked into one of the compartments. A creature not aware of the cursed nature of the device always sees its own reflection. The probability of a creature seeing its reflection and thus needing to attempt the saving throw drops to 50% if the creature is aware that the mirror is cursed and seeks to avoid looking at it (treat as a gaze attack).  When a creature's soul is trapped, its body remains outside of the mirror. The body becomes possessed by a malignant spirit who behaves in a way entirely opposed to how the trapped creature would. Treat this spirit as the creature, with  a reversed alignment (and potentially other factors reversed, such as being an antipaladin instead of a paladin). In the case of neutral characters, the spirit can be either chaotic evil or lawful good as decided by the GM. The death of the creature's original body does not free its soul from the mirror, though if it is ever set free, it immediately passes on to the afterlife as it no longer has a body to inhabit.  If the mirror's capacity is exceeded, one victim's soul (determined randomly) is set free and immediately reconnects with its duplicate body if available. If the mirror is destroyed (hardness 1, 5 hit points), all victims currently trapped in it are freed. Unless the mirror is destroyed, not even a miracle or wish can restore the trapped creature's spirit to its body.",,,Cursed,Occult Adventures,strong,45,0,0,,,4033
Scroll Of Blood Ink,varies,varies,none,,-,"This scroll can seem to contain any spell. When the wielder attempts to cast the spell, the ink turns to blood and runs off the page, ruining the spell automatically. The scroll's edges turn sharp and cut the wielder's hands and wrists, dealing 4 points of Constitution bleed. A successful DC 15 Reflex save halves the bleed. The bleed can be stopped with any magical healing or a successful DC 20 Heal check.",,,Cursed,Horror Adventures,none,0,0,0,,,4421
Staff Of Magical Decline,varies,varies,none,,5 lbs.,"This staff appears to be an ordinary staff and functions normally as such until it is used in combat. The wielder's effective caster level drops to match that of the staff or the wielder's caster level - 4, whichever is lower. The wielder's spellcasting ability score drops to 10 + staff's highest spell level, unless it is already lower.  The wielder must employ the staff rather than any other melee weapon or spell trigger item. Even if the staff is fully charged, the caster fails to regain spell slots for the day unless she forgoes a spell slot to restore 1 charge to the staff. However, she never again regains a spell slot used to charge the staff until she is freed from the curse. The only way for the wielder to be rid of the staff is by miracle or wish.",,,Cursed,Horror Adventures,none,5,0,0,,,4422
Book Of Perilous Journeys,strong conjuration,13,none,,1/2 lb.,"This leather-bound book looks like a journal partially ruined by moisture. The pages that are still legible detail three violent events that apparently took place while the writer was traveling through an unknown land. There are several varieties of the book, each describing a perilous journey through a different terrain type corresponding to the encounter tables on page 324 of the Pathfinder RPG Bestiary.  Reading any of the three accounts triggers the curse, after which the reader is compelled to protect the book at all costs and secretly read the other two accounts over the next 2 days. Each day the owner reads one of the accounts, monsters of a type appropriate to the book's terrain attack during the night. Determine the specific monsters by rolling on the appropriate encounter tables. If the prevailing weather is vastly different from typical weather in the climate described in the journal, a sudden change in weather usually heralds the arrival of the monsters (as per control weather).  Once the three attacks are over, the book mysteriously vanishes, lifting the curse. The book reappears later, however, at a random location.",,,Cursed,Horror Adventures,strong,0.5,0,0,,,4475
Needful Doll,strong conjuration and illusion,13,none,,1 lb.,"When a humanoid creature picks up this ugly old doll, he triggers a horrible curse. Thereafter, the cursed doll considers that creature its owner. If the owner leaves the doll, it appears next to him the next time he sleeps.  The doll is vindictive. If the owner repeatedly tries to get rid of it or leaves it behind at home, it torments him with terrible nightmares in which everyone he trusts abandons him. If the owner destroys the doll, he has disturbing nightmares in which people he trusts murder him in gruesome ways. If the owner keeps the doll in a backpack or other closed container for much  of the day, he has nightmares in which he slowly suffocates in a dark, cramped place.  The nightmares occur the next time the owner sleeps. This functions as per nightmare (DC 22); the doll is considered to have firsthand knowledge of the owner (or familiar knowledge if the owner has owned the doll for more than a week) and to have a body part. Regardless of how the owner abandons or destroys the doll, it returns the next night in the same condition as when the owner first found it. Using break enchantment or remove curse on the doll makes it unable to return for 1d4+1 days, though at that point, it returns as usual.  The doll is quick to forgive, however. If the owner treats it well for a day, carrying it openly and maintaining physical contact, the nightmares fade away until the doll feels that it has been mistreated again. The only certain way to get rid of or destroy the doll (short of miracle or wish) is to find someone who accepts it as a gift. If the owner dies, the curse is lifted, and the doll patiently waits until a new owner finds it, though if the previous owner returns from the dead before that time, the doll returns to his side.",,,Cursed,Horror Adventures,strong,1,0,0,,,4476
Unspeakable One's Vestments,strong varied,15,body,,1 lb.,"This robe functions much as a robe of stars, granting its wearer the luck bonus on saving throws, astral travel, and ability to create shuriken made of magically hardened gold. In addition, the wearer gains a +4 armor bonus to his AC.  The robe's curse activates after 1 month of being worn regularly, or just as a creature whose patron is Hastur or Xhamen-Dor affects the wearer with a spell or special ability. The wearer loses his luck bonus on saving throws against such effects and instead takes a -4 penalty on those saves. While the curse persists, the wearer takes 1d4 points of Wisdom drain every time he uses the robe to access the Astral Plane, and the shuriken created are +5 anarchic shuriken. After another month of continuous use, the wearer permanently becomes chaotic evil and pursues increasingly delusional goals of domination, enrichment, or anarchy. Once donned, this robe can be removed only with a remove curse spell.",,,Cursed,AP 113,strong,1,0,0,,,4621