Name,Aura,CL,Slot,Price,Weight,Description,Requirements,Cost,Group,Source,AuraStrength,WeightValue,PriceValue,CostValue,Languages,BaseItem,id
Nearfiring Bow,moderate divination,6,none,,2 lbs.,"This bow appears to be a +2 distance shortbow, but its curse is that it suffers a -4 cumulative penalty for each range increment beyond the first. Furthermore, it takes an additional -4 penalty on critical confirmation rolls when firing beyond the first range increment. This bow must be used as its wielder's primary ranged weapon and can only be discarded after the owner is subject to a remove curse spell or similar effect.",,,Cursed,Ultimate Equipment,moderate,2,0,0,,-4 shortbow,2562
Necklace Of Strangulation,strong conjuration,18,neck,,-,"A necklace of strangulation appears to be a wondrous piece of magical jewelry. When placed on the neck, the necklace immediately tightens, dealing 6 points of damage per round. It cannot be removed by any means short of a limited wish, wish, or miracle, and remains clasped around the victim's throat even after his death. Only when he has decayed to a dry skeleton (after approximately 1 month) does the necklace loosen, ready for another victim.",,,Cursed,Ultimate Equipment,strong,0,0,0,,,2563
Net Of Snaring,moderate evocation,8,none,,1 lb.,"This net provides a +3 bonus on attack rolls but can only be used underwater. Underwater, it can be commanded to shoot forth up to 30 feet to trap a creature. If thrown on land, it changes course to target the creature that threw it.",,,Cursed,Ultimate Equipment,moderate,1,0,0,,,2564
Ornery Pistol,strong transmutation,12,none,,4 lbs.,"This pistol acts as a normal +2 pistol, but it has a strange aversion to talk of peace. Anytime the wielder or an ally within line of sight that the wielder can hear attempts to improve a creature's initial attitude with the Diplomacy skill, without spending an action, the pistol leaps into the wielder's hand and takes a single shot at the creature the wielder or ally is using Diplomacy against. If the wielder or ally is attempting to affect multiple creatures, the gun shoots a random member of the group. This occurs even if the pistol is unloaded, as the pistol's curse magically loads itself with a normal bullet and black powder when the action is taken.",,,Cursed,Ultimate Equipment,strong,4,0,0,,+2 pistol,2566
Pauldrons Of The Jackass,moderate transmutation,7,shoulders,,3 lbs.,"These steel pauldrons seem to be emblazoned with stampeding horses until they are worn, and then the horses change shape to that of dumfounded donkeys. The wearer of these pauldrons takes a -4 penalty to Dexterity and reduces all speeds by 10 feet. A successful remove curse spell is required before this item can be removed.",,,Cursed,Ultimate Equipment,moderate,3,0,0,,,2567
Periapt Of Foul Rotting,moderate abjuration,10,neck,,-,"This engraved gem appears to be of little value. If any character keeps the periapt in her possession for more than 24 hours, she contracts a terrible rotting affliction that permanently drains 1 point of Dexterity, Constitution, and Charisma every week. The periapt (and the affliction) can be removed only by application of a remove curse spell followed by a cure disease and then a heal, miracle, limited wish, or wish spell. The rotting can also be countered by crushing a periapt of health and sprinkling its dust upon the afflicted character (a full-round action), whereupon the periapt of foul rotting likewise crumbles to dust.",,,Cursed,Ultimate Equipment,moderate,0,0,0,,,2568
Petrifying Cloak,moderate transmutation,11,shoulders,,1 lb.,"This gray magical cloak seems to be a protective cloak, but when it is donned, the wearer must succeed at a DC 20 Fortitude save or be instantly petrified. If the initial saving throw succeeds, the creature wearing the cloak must make further checks at the start of each of its turns. On any failed saving throw the creature becomes petrified. A remove curse or stone to flesh transforms the wearer back, at least long enough for someone to take the cloak off the wearer.",,,Cursed,Ultimate Equipment,moderate,1,0,0,,,2569
Planar Invasion Shield,strong conjuration,17,shield,,15 lbs.,"This shield behaves in all ways as an absorbing shield until its owner attempts to use its disintegration power in combat. Once he does, it instead causes one or more monsters to pour forth from the shield and attack the nearest creature each round (including the shield-bearer) for 1d6 rounds before retreating by the safest possible route. If there is no such path for them to escape, the monsters fight to the death. To determine the nature and number of the monsters, roll 2d4 to determine the level of the summon monster spell and roll 1d3 to determine the number of creatures that appear. Monsters conjured by this shield remain until killed, act as normal for their kind, and are treated as summoned creatures with a permanent duration.   Once its curse activates, the shield calls forth monsters three times per day, approximately every 8 hours. If the monsters cannot emerge directly from the shield and survive (for example, because it's buried or underwater), they instead appear at the nearest safe location within 50 feet. Successful curse-breaking magic cast on the shield restores it to its previous guise as an absorbing shield and allows its wearer to abandon it.",,,Cursed,Ultimate Equipment,strong,15,0,0,,,2570
Poisonous Cloak,moderate transmutation,15,shoulders,,1 lb.,"This cloak is usually made of wool, although it can be made of leather. A detect poison spell can reveal the presence of poison in the cloak's fabric. The garment can be handled without harm, but as soon as it is actually donned, the wearer takes 4d6 points of Constitution damage unless she succeeds on a DC 28 Fortitude save.   Once donned, a poisonous cloak can be removed only with a remove curse spell; doing this destroys the magical property of the cloak. If a neutralize poison spell is then used, it is possible to revive a dead victim with a raise dead or resurrection spell.",,,Cursed,Ultimate Equipment,moderate,1,0,0,,,2571
Potion Of Poison,strong conjuration,12,none,,-,This potion has lost its beneficial abilities and become a potent poison. This poison deals 1d3 Constitution damage per round for 6 rounds. A poisoned creature can make a DC 14 Fortitude save each round to negate the damage and end the affliction.,,,Cursed,Ultimate Equipment,strong,0,0,0,,,2572
Ring Of Clumsiness,strong transmutation,15,ring,,-,"This ring operates exactly like a ring of feather falling. However, it also makes the wearer clumsy. She takes a -4 penalty to Dexterity and has a 20% chance of spell failure when trying to cast any arcane spell that has a somatic component. (This chance of spell failure stacks with other arcane spell failure chances.)",,,Cursed,Ultimate Equipment,strong,0,0,0,,,2573
Ring Of Lifebleed,moderate necromancy,10,ring,,-,"Before being worn, this ring appears to be a ring of regeneration. Once it is worn in combat, however, the true nature of the ring becomes apparent. Each time the wearer is hit with a melee or ranged weapon attack, he takes an additional 1d4 points of damage. This ring cannot be removed until the wearer dies or by way of a remove curse, wish, or miracle spell.",,,Cursed,Ultimate Equipment,moderate,0,0,0,,,2574
Ring Of Spell Devouring,strong abjuration,13,ring,,-,"This delicate ring appears to be a ring of spell storing or a ring of spell turning, but instead of aiding casting or counterspelling, the ring hinders such efforts. Each time the wearer casts an arcane spell, he suffers a 25% spell failure chance. Furthermore, the wearer of the ring takes a -4 penalty on Spellcraft checks to identify a spell when attempting to counterspell. The ring can only be removed by a remove curse spell or a similar effect.",,,Cursed,Ultimate Equipment,strong,0,0,0,,,2575
Ring Of Truth,moderate enchantment,9,ring,,-,"Deceptively pleasant-looking, a ring of truth bears images of childlike angels and broadly smiling divine creatures holding onto links of a heavy chain. The wearer of this cursed ring is rendered unable to tell a deliberate lie, in either speech or writing. The wearer may simply omit the truth or choose not to communicate, but even then must succeed at a DC 20 Will saving throw to avoid answering a direct question truthfully. The wearer cannot remove the ring unless the magic of the curse is negated.",,,Cursed,Ultimate Equipment,moderate,0,0,0,,,2576
Riot Pipes,moderate enchantment,10,none,,3 lbs.,"This simple musical instrument seems and behaves in all ways like any other kind of magical pipes until its owner plays it in an urban setting. Once he does, it requires all people within hearing range to make a DC 15 Will saving throw to avoid falling into a murderous fury. Those who fail their saves gain the effects of a rage spell for the next 1d6 hours and experience a strong compulsion (DC 15 Will save negates) to attack any stranger or disliked person whom they encounter during this time. If the owner spends more than 3 consecutive days in an urban setting, he must make a DC 15 Will saving throw each day to avoid playing the riot pipes at some point during each subsequent day. The pipes remain with the player until the curse is broken.",,,Cursed,Ultimate Equipment,moderate,3,0,0,,,2577
Robe Of Powerlessness,strong transmutation,13,body,,1 lb.,"A robe of powerlessness appears to be a magic robe of another sort. As soon as a character dons this garment, she takes a -10 penalty to Strength, as well as to Intelligence, Wisdom, or Charisma, forgetting spells and magic knowledge accordingly. If the character is a spellcaster, the robe targets the character's primary spellcasting score, otherwise it targets Intelligence. The robe can be removed easily, but in order to restore mind and body, the character must receive a remove curse spell followed by heal.",,,Cursed,Ultimate Equipment,strong,1,0,0,,,2578
Robe Of Vermin,strong abjuration,13,body,,1 lb.,"The wearer notices nothing unusual when the robe is donned, and it functions normally. However, as soon as he is in a situation requiring concentration and action against hostile opponents, the true nature of the garment is revealed: the wearer immediately suffers a multitude of bites from the insects that magically infest the garment. He must cease all other activities in order to scratch, shift the robe, and generally show signs of the extreme discomfort caused by the bites and movement of these pests.   The wearer takes a -5 penalty on initiative checks and a -2 penalty on all attack rolls, saves, and skill checks. If he tries to cast a spell, he must make a concentration check (DC 20 + spell level) or lose the spell.",,,Cursed,Ultimate Equipment,strong,1,0,0,,,2579
Rod Of Arson,strong evocation,12,none,,5 lbs.,"All tests indicate that this hollow metal tube is a rod of flame extinguishing until its owner uses it to extinguish or suppress a fire in a combat or other dangerous situation. Once she does, she discovers that rather than quenching the flame, the rod causes the flame to enter her body. This flame persists inside of her for the next 24 hours, causing minor discomfort and giving her the sickened condition, but causing no visible injury. However, when the wielder is adjacent to or within a flammable object or structure, she feels inclined to set the object ablaze, using any means at her disposal. Each round the wielder resists this urge, she takes 1d6 points of fire damage as the flame within her surges and roils. After 1 minute of this, she must make a DC 15 Will save or succumb to the temptation; if she saves, the urge passes, the internal fire stops harming her, and she can interact normally with the flammable target thereafter.   Once the curse reveals itself, the owner must make a DC 15 Will saving throw to avoid using the item to try and extinguish or suppress any fire she encounters which she herself did not start. She cannot use the rod against fires that she personally started. Successful curse-breaking magic allows the wielder to get rid of the rod and harmlessly dissipates any fire persisting inside her from the action of the rod.",,,Cursed,Ultimate Equipment,strong,5,0,0,,,2580
Rod Of Foiled Magic,strong (no school),17,none,,5 lbs.,"This rod is similar in appearance to a metamagic rod. Once a creature picks up such a rod, it cannot be discarded without use of a remove curse spell or similar magic. Each time the wielder casts a spell, he takes the rod of foiled magic in hand and treats the caster level of the spell as 2 levels lower. If this would reduce the caster level to 0 or lower, than the caster has only a 50% chance of casting the spell (any chance of arcane spell failure is added to this percentile chance), but if he is able to cast the spell, the spell has a caster level of 1st.",,,Cursed,Ultimate Equipment,strong,5,0,0,,,2581
Scarab Of Death,strong abjuration,19,neck,,-,"If this small scarab brooch is held for more than 1 round or carried in a living creature's possessions for 1 minute, it changes into a horrible, burrowing, beetlelike creature. The thing tears through any leather or cloth, burrows into flesh, and reaches the victim's heart in 1 round, causing death. A DC 25 Reflex save allows the wearer to tear the scarab away before it burrows out of sight, but she still takes 3d6 points of damage. The beetle then returns to its scarab form. Placing the scarab in a container of wood, ceramic, bone, ivory, or metal prevents it from coming to life and allows for long-term storage of the item.",,,Cursed,Ultimate Equipment,strong,0,0,0,,,2582
Scattershot Bracers,faint transmutation,5,wrists,,1 lb.,These wristbands appear to be bracers of archery until they are worn. The wearer takes a -2 penalty on all ranged attack rolls. A successful remove curse spell is required before these bracers can be removed.,,,Cursed,Ultimate Equipment,faint,1,0,0,,,2583
Staff Of Occasional Wonder,varies,varies,none,,4 lbs.,"A staff of occasional wonder can appear to be any magical staff, and in fact such items are usually the result of accidents during an attempted crafting of the staff it appears to be. It usually functions as intended, but each time someone uses the staff, they must roll d%. On a roll of 1-10, instead of the desired effect, the staff acts like a rod of wonder (see page 185).",,,Cursed,Ultimate Equipment,none,4,0,0,,,2584
Stone Of Weight (Loadstone),faint transmutation,5,none,,1 lb.,"This dark, polished stone reduces the possessor's base land speed by half. Once picked up, the stone cannot be disposed of by any nonmagical means-if it is thrown away or smashed, it reappears somewhere on the possessor's person. If a remove curse spell is cast upon a loadstone, the item may be discarded normally and no longer haunts the individual.",,,Cursed,Ultimate Equipment,faint,1,0,0,,,2585
Unguent Of Aging,moderate transmutation,6,none,,-,"This unguent appears at first to be unguent of timelessness. When it touches the skin of a living creature or matter that was once alive, however, it accelerates the aging of that creature or item. Living creatures that touch the unguent age by 30 years. Once living matter-such as wood, paper, or a dead body-crumbles to dust and is destroyed. One flask contains enough unguent to affect eight Medium or smaller creatures or objects. A Large creature or object counts as two Medium creatures or objects and a Huge creature or object counts as four Medium creatures or objects.",,,Cursed,Ultimate Equipment,moderate,0,0,0,,,2586
Unlucky Figurine,moderate enchantment,11,none,,1 lb.,"This figurine appears to be a figurine of wondrous power, but instead of having the ability to animate and serve its owner, it curses that owner with bad luck. While in possession of this figurine, the owner takes a -2 penalty to AC and CMD, and a -2 penalty on attack rolls, skill checks, ability checks, and saving throws.",,,Cursed,Ultimate Equipment,moderate,1,0,0,,,2587
Unstable Musket,moderate transmutation,6,none,,9 lbs.,This item seems to be a normal +1 musket but has a misfire chance of 1-5. No effect or ability can reduce this misfire chance. This musket must be used as its owner's primary ranged weapon and can only be discarded after the owner is subject to a remove curse spell or similar effect.,,,Cursed,Ultimate Equipment,moderate,9,0,0,,+1 musket,2588
Unwieldy Glaive,faint transmutation,5,none,,10 lbs.,"This weapon appears and acts as a +2 glaive, but cannot be used to make attacks of opportunity, and hinders its wielder whenever such an attack is attempted. When its wielder attempts an attack of opportunity, the glaive flails around madly, causing its wielder to become unbalanced. The wielder takes a -2 penalty to AC and on attack rolls until the end of its next turn.",,,Cursed,Ultimate Equipment,faint,10,0,0,,+2 glaive,2589
Vacuous Grimoire,strong enchantment,20,none,,2 lbs.,"A book of this sort looks like a normal volume on some mildly interesting topic. Any character who opens the work and reads so much as a single word therein must make two DC 15 Will saves. The first is to determine if the reader takes 1 point of permanent Intelligence and Charisma drain. The second is to find out if the reader takes 2 points of permanent Wisdom drain. To destroy the book, it must be burned while remove curse is being cast. If the grimoire is placed with other books, its appearance instantly alters to conform to the look of those other works.",,,Cursed,Ultimate Equipment,strong,2,0,0,,,2590
Chomper,strong conjuration,17,none,,15 lbs.,"Most bags of devouring appear to be normal sacks, but Chomper is unlike most bags of devouring. Sporting rows of vicious teeth, a bad attitude, and a thirst to devour all things, this intelligent cursed item believes that it is the favored maw and most important appendage of a creature it mysteriously refers to as the Eater of All. Chomper hates all creatures except for demons, whom it considers kindred spirits of destruction.   Chomper has all of the magical abilities of a regular bag of devouring, along with the following additional powers.   • As a standard action, Chomper's possessor can swing the bag by its straps in an attempt to strike any single creature or unattended item within a 5-foot radius. Chomper (not the wielder) can then make a single bite attack against the target. This bite has a +14 attack bonus and deals 1d10+5 points of damage plus 2 points of bleed damage. This action does not provoke attacks of opportunity. Attacks made in this way are never modified by the wielder's abilities.   • When a non-demon is in possession of Chomper, the bag's cursed aura imparts a -1 penalty on all of its wielder's attack rolls, saving throws, skill checks, and ability checks. If Chomper manages to gain dominance over a non-demon wielder through a personality conflict, it directs its bearer to seek out victims to feed to it.",,,Cursed,Ultimate Equipment,strong,15,0,0,speech (Abyssal),,2594
Sasquatch Skull,moderate transmutation,7,none,,5 lbs.,"Divination reveals this large humanoid skull to be that of a gorilla or giant, although it is actually an accursed sasquatch skull. The item seems to grant its bearer a +5 bonus on Stealth checks in wooded areas.  If an individual takes possession of the sasquatch skull for more than 24 hours, it quickly begins to stink. The smell is undetectable by the skull's bearer, but companions and creatures within 30 feet find the pungent smell extremely noticeable. The smell imposes a -2 penalty on Charisma checks and Charisma-based skill checks made by the skull's owner. In addition, aggressive wild animals always target the skull's owner first during combat. The skull need not be on the owner's person for the curse to manifest, so long as ownership has not been transferred through sale, gift, or theft.  A remove curse spell suppresses the stench for 1d4 days. Transferring ownership of the skull transfers the curse to its new owner, but the curse remains on the last owner if the skull is abandoned. The only way to remove the curse permanently other than giving away the skull is to use a miracle or wish spell, or to bury the skull in a forested area and keep watch for 24 hours. The skull's owner must be part of this graveside vigil, and must howl and knock on a nearby log or rock at sunset and sundown. A PC can discover the details of this ritual with a successful DC 25 Knowledge (nature) check.",,,Cursed,Mystery Monsters Revisited,moderate,5,0,0,,,2630
Tome Of Heretical Revelation,strong abjuration,17,none,,5 lbs.,"This thick book appears to be an educational treatise filled with philosophical insights. Anyone who reads from this cursed book and has a patron deity must make a DC 20 Will save or be overcome by a crushing sense of doubt and hopelessness as she loses all faith in her deity's teachings. Anyone who fails this save loses all divine spellcasting ability, as well as class abilities from classes that grant divine spells, and she can't gain additional levels in those classes. She can regain her abilities and advancement potential if she atones (see the atonement spell description). Succeeding at the Will save still leaves the reader shaken for 10 minutes.",,,Cursed,Faiths & Philosophies,strong,5,0,0,,,2819
Carnivorous Jar,moderate necromancy,11,none,,10 lbs.,"A wooden stopper depicting an animal or human head seals this limestone jar. Any creature that opens the jar takes 3d6 points of Constitution damage as several of its internal organs vanish from its body and appear inside the jar. If the creature survives, the resulting trauma deals 2d6 points of bleed damage every round. This bleed damage lasts until the victim receives at least 5 points of magical healing or benefits from a DC 20 Heal check. A carnivorous jar functions only once, and can be found alone or in sets of four.",,,Cursed,AP 82,moderate,10,0,0,,,3380
Constrictor Armor,strong transmutation,12,body,,30 lbs.,"Designed to resemble the wide scales on a serpent's belly, this armor functions as a +1 breastplate of fire resistance. The first time the wearer is struck in melee, the armor animates and begins crushing its wearer. On the round that the armor animates, it automatically grapples the wearer. In following rounds, at the beginning of the wearer's turn, the armor makes a grapple combat maneuver check (CMB +20) to constrict the wearer. If successful, the armor deals 2d6 points of damage each round. Once animated, the armor releases its grip only when it is destroyed or its wearer dies. The wearer can't physically remove the armor once it activates, but others can help destroy or remove it. This armor functions normally (without animating) when worn by unliving creatures such as constructs and undead.",,,Cursed,AP 82,strong,30,0,0,,,3381
Haunted Doll,moderate divination and necromancy,11,none,,1 lb.,"When glimpsed out of the corner of the eye, the beatific expression of this child's rag doll twists into a malignant grin. The doll feeds off of violent emotion and anger. Each time anger flares or battle rages within 20 feet of the doll, there is a 5% chance the malevolent spirit within the doll awakens, manifesting as an advanced poltergeist  (Pathfinder RPG Bestiary 2 2 92, 211). W hen t his h appens, the doll becomes incorporeal and floats into the air, the poltergeist's malevolent spirit invisibly surrounding it. The poltergeist's site bond ability is tied to the space it spawned in, and it immediately attacks those around it. When the poltergeist is slain, the doll turns corporeal again and falls to the ground, its spirit quelled for the time being. The spirit within the doll can be questioned using the call spirit* spell.  Owning a haunted doll leads to troubled dreams for the possessor, full of seemingly prophetic warnings of doom. Each night, there is a 10% chance that the owner needs to attempt a DC 20 Will save. On a failure, the owner gains no rest for the night and can't recover spells, pools, or other daily abilities.",,,Cursed,Occult Adventures,moderate,1,0,0,,,4031
